{
  "schemaVersion": 1,
  "lessonId": "M01-L002",
  "passScore": 80,
  "generatedAt": "2026-03-21T06:25:09.882Z",
  "itemBankPath": "M01-L002-quiz-item-bank.json",
  "questions": [
    {
      "id": "q01",
      "vocabId": "v-6acb169e4b",
      "type": "thai_to_english",
      "displayMode": "thai_only",
      "prompt": {
        "text": "What is the best meaning of ชื่อ?",
        "thai": "ชื่อ",
        "translit": "chûue"
      },
      "options": [
        "name",
        "what is your name?",
        "come from",
        "country"
      ],
      "answer": "name",
      "rationale": "Maps Thai form to target meaning from script languageFocus.",
      "bankItemId": "v-6acb169e4b-thai-to-english"
    },
    {
      "id": "q02",
      "vocabId": "v-a79c6af3af",
      "type": "thai_to_english",
      "displayMode": "thai_only",
      "prompt": {
        "text": "What is the best meaning of คุณชื่ออะไร?",
        "thai": "คุณชื่ออะไร",
        "translit": "khun chûue à-rai"
      },
      "options": [
        "what is your name?",
        "name",
        "come from",
        "country"
      ],
      "answer": "what is your name?",
      "rationale": "Maps Thai form to target meaning from script languageFocus.",
      "bankItemId": "v-a79c6af3af-thai-to-english"
    },
    {
      "id": "q03",
      "vocabId": "v-ce7cc833ec",
      "type": "thai_to_english",
      "displayMode": "thai_only",
      "prompt": {
        "text": "What is the best meaning of มาจาก?",
        "thai": "มาจาก",
        "translit": "maa-jàak"
      },
      "options": [
        "come from",
        "name",
        "what is your name?",
        "country"
      ],
      "answer": "come from",
      "rationale": "Maps Thai form to target meaning from script languageFocus.",
      "bankItemId": "v-ce7cc833ec-thai-to-english"
    },
    {
      "id": "q04",
      "vocabId": "v-d0c316cc2c",
      "type": "thai_to_english",
      "displayMode": "thai_only",
      "prompt": {
        "text": "What is the best meaning of ประเทศ?",
        "thai": "ประเทศ",
        "translit": "bprà-thêet"
      },
      "options": [
        "country",
        "name",
        "what is your name?",
        "come from"
      ],
      "answer": "country",
      "rationale": "Maps Thai form to target meaning from script languageFocus.",
      "bankItemId": "v-d0c316cc2c-thai-to-english"
    },
    {
      "id": "q05",
      "vocabId": "v-f0b2ddeed3",
      "type": "thai_to_english",
      "displayMode": "thai_only",
      "prompt": {
        "text": "What is the best meaning of ไทย?",
        "thai": "ไทย",
        "translit": "thai"
      },
      "options": [
        "Thailand / Thai",
        "name",
        "what is your name?",
        "come from"
      ],
      "answer": "Thailand / Thai",
      "rationale": "Maps Thai form to target meaning from script languageFocus.",
      "bankItemId": "v-f0b2ddeed3-thai-to-english"
    },
    {
      "id": "q06",
      "vocabId": "v-8adc81e330",
      "type": "thai_to_english",
      "displayMode": "thai_only",
      "prompt": {
        "text": "What is the best meaning of อังกฤษ?",
        "thai": "อังกฤษ",
        "translit": "ang-grìt"
      },
      "options": [
        "England / English",
        "name",
        "what is your name?",
        "come from"
      ],
      "answer": "England / English",
      "rationale": "Maps Thai form to target meaning from script languageFocus.",
      "bankItemId": "v-8adc81e330-thai-to-english"
    },
    {
      "id": "q07",
      "vocabId": "v-9ca06d0136",
      "type": "thai_to_english",
      "displayMode": "thai_only",
      "prompt": {
        "text": "What is the best meaning of อเมริกา?",
        "thai": "อเมริกา",
        "translit": "à-mee-rí-kaa"
      },
      "options": [
        "America",
        "name",
        "what is your name?",
        "come from"
      ],
      "answer": "America",
      "rationale": "Maps Thai form to target meaning from script languageFocus.",
      "bankItemId": "v-9ca06d0136-thai-to-english"
    },
    {
      "id": "q08",
      "vocabId": "v-6bb42f6e5c",
      "type": "thai_to_english",
      "displayMode": "thai_only",
      "prompt": {
        "text": "What is the best meaning of คน?",
        "thai": "คน",
        "translit": "khon"
      },
      "options": [
        "person",
        "name",
        "what is your name?",
        "come from"
      ],
      "answer": "person",
      "rationale": "Maps Thai form to target meaning from script languageFocus.",
      "bankItemId": "v-6bb42f6e5c-thai-to-english"
    },
    {
      "id": "q09",
      "vocabId": "v-51bd1e627d",
      "type": "thai_to_english",
      "displayMode": "thai_only",
      "prompt": {
        "text": "What is the best meaning of ชื่อ?",
        "thai": "ชื่อ",
        "translit": "chûue"
      },
      "options": [
        "name (falling tone)",
        "name",
        "what is your name?",
        "come from"
      ],
      "answer": "name (falling tone)",
      "rationale": "Maps Thai form to target meaning from script languageFocus.",
      "bankItemId": "v-51bd1e627d-thai-to-english"
    },
    {
      "id": "q10",
      "vocabId": "v-6acb169e4b",
      "type": "english_to_thai",
      "displayMode": "english_only",
      "prompt": {
        "text": "Select Thai for: name",
        "english": "name"
      },
      "options": [
        "ชื่อ",
        "คุณชื่ออะไร",
        "มาจาก",
        "ประเทศ"
      ],
      "answer": "ชื่อ",
      "rationale": "Reverses mapping for active recall.",
      "bankItemId": "v-6acb169e4b-english-to-thai"
    },
    {
      "id": "q11",
      "vocabId": "v-6acb169e4b",
      "type": "fill_translit",
      "displayMode": "thai_only",
      "prompt": {
        "text": "Type the PTM transliteration for ชื่อ.",
        "thai": "ชื่อ"
      },
      "answer": "chûue",
      "rationale": "Forces transliteration production with inline tone marks.",
      "bankItemId": "v-6acb169e4b-fill-translit"
    },
    {
      "id": "q12",
      "vocabId": "v-6acb169e4b",
      "type": "context_mcq",
      "displayMode": "triplet",
      "prompt": {
        "text": "Choose the sentence that keeps the lesson meaning of this phrase.",
        "thai": "ชื่อ",
        "translit": "chûue",
        "english": "name"
      },
      "options": [
        "Use ชื่อ in polite beginner conversation",
        "Use คุณชื่ออะไร in polite beginner conversation",
        "Use มาจาก in polite beginner conversation",
        "Use ประเทศ in polite beginner conversation"
      ],
      "answer": "Use ชื่อ in polite beginner conversation",
      "rationale": "Checks contextual understanding while preserving triplet exposure.",
      "bankItemId": "v-6acb169e4b-context-mcq"
    },
    {
      "id": "q13",
      "vocabId": "v-a79c6af3af",
      "type": "english_to_thai",
      "displayMode": "english_only",
      "prompt": {
        "text": "Select Thai for: what is your name?",
        "english": "what is your name?"
      },
      "options": [
        "คุณชื่ออะไร",
        "ชื่อ",
        "มาจาก",
        "ประเทศ"
      ],
      "answer": "คุณชื่ออะไร",
      "rationale": "Reverses mapping for active recall.",
      "bankItemId": "v-a79c6af3af-english-to-thai"
    },
    {
      "id": "q14",
      "vocabId": "v-a79c6af3af",
      "type": "fill_translit",
      "displayMode": "thai_only",
      "prompt": {
        "text": "Type the PTM transliteration for คุณชื่ออะไร.",
        "thai": "คุณชื่ออะไร"
      },
      "answer": "khun chûue à-rai",
      "rationale": "Forces transliteration production with inline tone marks.",
      "bankItemId": "v-a79c6af3af-fill-translit"
    },
    {
      "id": "q15",
      "vocabId": "v-a79c6af3af",
      "type": "context_mcq",
      "displayMode": "triplet",
      "prompt": {
        "text": "Choose the sentence that keeps the lesson meaning of this phrase.",
        "thai": "คุณชื่ออะไร",
        "translit": "khun chûue à-rai",
        "english": "what is your name?"
      },
      "options": [
        "Use คุณชื่ออะไร in polite beginner conversation",
        "Use ชื่อ in polite beginner conversation",
        "Use มาจาก in polite beginner conversation",
        "Use ประเทศ in polite beginner conversation"
      ],
      "answer": "Use คุณชื่ออะไร in polite beginner conversation",
      "rationale": "Checks contextual understanding while preserving triplet exposure.",
      "bankItemId": "v-a79c6af3af-context-mcq"
    },
    {
      "id": "q16",
      "vocabId": "v-ce7cc833ec",
      "type": "english_to_thai",
      "displayMode": "english_only",
      "prompt": {
        "text": "Select Thai for: come from",
        "english": "come from"
      },
      "options": [
        "มาจาก",
        "ชื่อ",
        "คุณชื่ออะไร",
        "ประเทศ"
      ],
      "answer": "มาจาก",
      "rationale": "Reverses mapping for active recall.",
      "bankItemId": "v-ce7cc833ec-english-to-thai"
    }
  ],
  "coverage": {
    "minimumQuizItemsPerNewVocab": 1,
    "perVocab": [
      {
        "vocabId": "v-6acb169e4b",
        "thai": "ชื่อ",
        "quizItemCount": 4
      },
      {
        "vocabId": "v-a79c6af3af",
        "thai": "คุณชื่ออะไร",
        "quizItemCount": 4
      },
      {
        "vocabId": "v-ce7cc833ec",
        "thai": "มาจาก",
        "quizItemCount": 2
      },
      {
        "vocabId": "v-d0c316cc2c",
        "thai": "ประเทศ",
        "quizItemCount": 1
      },
      {
        "vocabId": "v-f0b2ddeed3",
        "thai": "ไทย",
        "quizItemCount": 1
      },
      {
        "vocabId": "v-8adc81e330",
        "thai": "อังกฤษ",
        "quizItemCount": 1
      },
      {
        "vocabId": "v-9ca06d0136",
        "thai": "อเมริกา",
        "quizItemCount": 1
      },
      {
        "vocabId": "v-6bb42f6e5c",
        "thai": "คน",
        "quizItemCount": 1
      },
      {
        "vocabId": "v-51bd1e627d",
        "thai": "ชื่อ",
        "quizItemCount": 1
      }
    ],
    "pass": true
  }
}
